{
  "schema": "docsort.io/downloads-index/v1",
  "project": "docsort",
  "base_url": "/downloads/docsort",
  "latest": "v0.4.3",
  "versions": [
    {
      "tag": "v0.4.3",
      "version": "0.4.3",
      "published_at": "2026-08-13T01:24:49Z",
      "notes": "# DocSort release notes\n\n## v0.4.3\n\nDocSort now checks that an update really is the version it claims to be, and\nrefuses to move backwards.\n\n### Highlights\n\n- **Updates are bound to their version.** Before downloading anything, DocSort\n  fetches the signed release record for the version being offered, checks that\n  signature against a key built into the app, and confirms the update feed it was\n  served is exactly the one that record covers. An update whose advertised version\n  does not match its signed release is refused.\n- **No downgrades.** An update is only installed when it is genuinely newer than\n  the version you are running. An offer to \"update\" to something older or\n  identical is rejected.\n\n### Correction to the v0.4.2 release notes\n\nv0.4.2 said a tampered or substituted download could not be installed. That was\nstated too broadly, and this release is what makes it accurate.\n\nv0.4.2 verified the signature of the file it downloaded, so it would not install a\nfile that was not signed by the DocSort release key. What it did not check was\nwhether the file it was offered was the file belonging to the version being\nadvertised. Anyone able to alter the update feed could have paired a high version\nnumber with an older, genuinely signed DocSort build — the signature check would\nhave passed and the older build would have installed. That is a downgrade or\nreplay, not arbitrary code: an attacker still could not have made DocSort install\nsomething the release key had never signed.\n\nNothing suggests this happened. The v0.4.2 release notes are published as a\nsigned, content-addressed file and cannot be edited after the fact, so this is\nwhere the correction lives.\n\n### Upgrade notes\n\n- If you are on v0.4.2, DocSort can install this release itself.\n- Earlier versions have no working update endpoint and need a one-time manual\n  install.\n\n### Supported platforms\n\n- macOS (Apple Silicon)\n- Windows (x86-64)\n- Linux (x86-64: AppImage, .deb)\n\nDownloads are integrity-checked: every installer's SHA-256 is listed in `SHA256SUMS`,\nand the release manifest is signed.\n",
      "notes_url": "/downloads/docsort/releases/v0.4.3/release-notes-public.md",
      "manifest_url": "/downloads/docsort/releases/v0.4.3/manifest.json",
      "assets": [
        {
          "id": "linux-appimage",
          "label": "Linux (AppImage)",
          "os": "linux",
          "arch": "",
          "kind": "appimage",
          "primary": true,
          "filename": "DocSort_0.4.3_amd64.AppImage",
          "url": "/downloads/docsort/releases/v0.4.3/DocSort_0.4.3_amd64.AppImage",
          "content_type": "application/octet-stream",
          "size_bytes": 86919672,
          "sha256": "a1f28ea3eda4b9c1c67686f477b7d79ec3e05715a6fa87bbc8019bde278b1762"
        },
        {
          "id": "linux-deb",
          "label": "Linux (.deb)",
          "os": "linux",
          "arch": "",
          "kind": "deb",
          "primary": false,
          "filename": "DocSort_0.4.3_amd64.deb",
          "url": "/downloads/docsort/releases/v0.4.3/DocSort_0.4.3_amd64.deb",
          "content_type": "application/octet-stream",
          "size_bytes": 11283016,
          "sha256": "c6faf3b0204a7a9108bbab07d2a2231fe7903d232e2398e885e835ae2b1775c1"
        },
        {
          "id": "macos-appzip",
          "label": "macOS (app bundle)",
          "os": "macos",
          "arch": "",
          "kind": "appzip",
          "primary": false,
          "filename": "DocSort-0.4.3-macos.app.zip",
          "url": "/downloads/docsort/releases/v0.4.3/DocSort-0.4.3-macos.app.zip",
          "content_type": "application/octet-stream",
          "size_bytes": 9791856,
          "sha256": "c345f4cbbb38fbc7bf122fc72f13d3afef1bfa1bc1fcd864d44b28990c27de1f"
        },
        {
          "id": "macos-dmg",
          "label": "macOS (.dmg)",
          "os": "macos",
          "arch": "",
          "kind": "dmg",
          "primary": true,
          "filename": "DocSort_0.4.3_aarch64.dmg",
          "url": "/downloads/docsort/releases/v0.4.3/DocSort_0.4.3_aarch64.dmg",
          "content_type": "application/x-apple-diskimage",
          "size_bytes": 10133610,
          "sha256": "df0de5a1abb8ee62ed7ce18de02501e7674f7a2efd7176385335be9f971d318f"
        },
        {
          "id": "windows-msi",
          "label": "Windows (.msi)",
          "os": "windows",
          "arch": "",
          "kind": "msi",
          "primary": false,
          "filename": "DocSort_0.4.3_x64_en-US.msi",
          "url": "/downloads/docsort/releases/v0.4.3/DocSort_0.4.3_x64_en-US.msi",
          "content_type": "application/octet-stream",
          "size_bytes": 53248000,
          "sha256": "60f3b98076a8a6c248c153375c077e32fe89d1eee0cddc0f7ee7654472650f11"
        },
        {
          "id": "windows-exe",
          "label": "Windows (.exe)",
          "os": "windows",
          "arch": "",
          "kind": "exe",
          "primary": true,
          "filename": "DocSort_0.4.3_x64-setup.exe",
          "url": "/downloads/docsort/releases/v0.4.3/DocSort_0.4.3_x64-setup.exe",
          "content_type": "application/octet-stream",
          "size_bytes": 37538902,
          "sha256": "dcd128098037d17576aed691b040002acce49eed6499accce0a9b1b028607303"
        }
      ]
    },
    {
      "tag": "v0.4.2",
      "version": "0.4.2",
      "published_at": "2026-08-11T01:22:13Z",
      "notes": "# DocSort release notes\n\n## v0.4.2\n\nAutomatic updates work from this release onward, and filing history stays fast as\nit grows.\n\n### Highlights\n\n- **Automatic updates.** DocSort now checks for new versions, verifies each update's\n  signature before installing it, and installs it for you. Updates are refused\n  unless they were signed by the DocSort release key, so a tampered or substituted\n  download cannot be installed.\n- **History that stays fast.** Filing history is now paged and bounded by a\n  retention policy, so browsing stays responsive no matter how many documents you\n  have filed. Counts and filter chips reflect what is actually stored.\n- **History tells the truth about undo.** An entry now shows whether its filing was\n  undone, and undo state stays accurate after a restart.\n\n### Fixes\n\n- Undo is crash-safe and works across volumes: interrupting an undo can no longer\n  leave a document half-moved between drives.\n- Filing history records survive a crash and are validated when read, so an\n  interrupted write can no longer corrupt the history view.\n- OCR failures are reported per component instead of silently degrading. A PDF that\n  fails OCR no longer returns partial or empty text as if it were the document's\n  contents.\n- The Windows installer now carries a verified OCR runtime, so text extraction works\n  on a clean Windows machine without a separate install.\n- Errors from background operations surface in the interface instead of failing\n  quietly.\n- Removed a duplicate read during document analysis.\n\n### Upgrade notes\n\n- Earlier versions shipped without a working update endpoint, so **updating to\n  v0.4.2 is a one-time manual install**. From v0.4.2 onward DocSort updates itself.\n- Your existing filing history is retained. The first launch after updating applies\n  the new retention policy, which may trim very old entries.\n\n### Known issues\n\n- Automatic updates are delivered for macOS (Apple Silicon), Windows (x86-64), and\n  Linux x86-64 AppImage. The Linux `.deb` package is a manual download and is not\n  served by the updater.\n\n### Supported platforms\n\n- macOS (Apple Silicon)\n- Windows (x86-64)\n- Linux (x86-64: AppImage, .deb)\n\nDownloads are integrity-checked: every installer's SHA-256 is listed in `SHA256SUMS`,\nand the release manifest is signed.\n",
      "notes_url": "/downloads/docsort/releases/v0.4.2/release-notes-public.md",
      "manifest_url": "/downloads/docsort/releases/v0.4.2/manifest.json",
      "assets": [
        {
          "id": "linux-appimage",
          "label": "Linux (AppImage)",
          "os": "linux",
          "arch": "",
          "kind": "appimage",
          "primary": true,
          "filename": "DocSort_0.4.2_amd64.AppImage",
          "url": "/downloads/docsort/releases/v0.4.2/DocSort_0.4.2_amd64.AppImage",
          "content_type": "application/octet-stream",
          "size_bytes": 86837752,
          "sha256": "ae804da053f77fc4d8be190f1dc71776aed935aca901c249961a63f9c444f0c5"
        },
        {
          "id": "linux-deb",
          "label": "Linux (.deb)",
          "os": "linux",
          "arch": "",
          "kind": "deb",
          "primary": false,
          "filename": "DocSort_0.4.2_amd64.deb",
          "url": "/downloads/docsort/releases/v0.4.2/DocSort_0.4.2_amd64.deb",
          "content_type": "application/octet-stream",
          "size_bytes": 11191876,
          "sha256": "b2a30032d2cf190c31181dff9f85064443a7a75cffe4178900e23e3c0d11b33b"
        },
        {
          "id": "macos-appzip",
          "label": "macOS (app bundle)",
          "os": "macos",
          "arch": "",
          "kind": "appzip",
          "primary": false,
          "filename": "DocSort-0.4.2-macos.app.zip",
          "url": "/downloads/docsort/releases/v0.4.2/DocSort-0.4.2-macos.app.zip",
          "content_type": "application/octet-stream",
          "size_bytes": 9700914,
          "sha256": "90badb8e7280e77acbbebe3719a5d2a59ac8f3f501fb991bbf3fa495ec8e599d"
        },
        {
          "id": "macos-dmg",
          "label": "macOS (.dmg)",
          "os": "macos",
          "arch": "",
          "kind": "dmg",
          "primary": true,
          "filename": "DocSort_0.4.2_aarch64.dmg",